{
  "$schema": "rusty.manifold.peer.topology_authorization.v1",
  "decision_id": "decision.peer-session.fixture.001",
  "session_id": "session.peer.fixture.001",
  "proposal_id": "proposal.peer.fixture.001",
  "authority_revision": 7,
  "group_owner_peer_id": "peer.fixture.owner",
  "client_peer_id": "peer.fixture.client",
  "topology_contract_id": "rusty.quest.product_wifi_direct_topology.v1",
  "authorized": true,
  "valid_from_ms": 1000,
  "expires_at_ms": 61000,
  "denial_reason": null
}
